id	statement	keywords
S-1423	Common pitfalls include pre-lattice leaks, band drift, meter drift, off-eligibility edits, and accepted energy bumps.	accepted,band,bumps,common,drift,edits,energy,include,leaks,meter,off-eligibility,pitfalls,pre-lattice
S-1424	Publish checklist includes one-time quantization, transport-key agreement, non-increasing Delta-Energy, and Theta on first failing gate.	agreement,checklist,delta-energy,failing,first,gate,includes,non-increasing,one-time,publish,quantization,theta,transport-key
S-1425	Receipts-per-season table explicitly maps Winter->Gate, Spring->Merge, Summer->Lock.	explicitly,gate,lock,maps,merge,receipts-per-season,spring-,summer-,table,winter-
S-1426	Winter allows permission measurements and forbids phase-amplitude edits.	allows,edits,forbids,measurements,permission,phase-amplitude,winter
S-1427	Winter must log eligibility panel, hazard timeline, hats snapshot, and CPL read.	cpl,eligibility,hats,hazard,log,must,panel,read,snapshot,timeline,winter
S-1428	Winter requires CRL/3DL and E0 calibration.	3dl,calibration,crl,e0,requires,winter
S-1429	Winter timers require W_epsilon settled and horizon started.	horizon,require,settled,started,timers,w_epsilon,winter
S-1430	Winter artifacts include PCO hashes, meter list, declared bands, and optional Omega frontier.	artifacts,bands,declared,frontier,hashes,include,list,meter,omega,optional,pco,winter
S-1431	Winter typical Theta is calibration/CRL or eligibility/hazard.	calibration,crl,eligibility,hazard,theta,typical,winter
S-1432	Spring allows lawful alignment under SHR precedence with one-snap discipline.	alignment,allows,discipline,lawful,one-snap,precedence,shr,spring,under
S-1433	Spring must log E1 mute, E2 symmetry, phase corridor trace, amplitude ledger, Delta-Energy staircase, and CPL trace.	amplitude,corridor,cpl,delta-energy,e1,e2,ledger,log,must,mute,phase,spring,staircase,symmetry,trace
S-1434	Spring requires phase and hazard bands with E1/E2 green around edits.	around,bands,e1,e2,edits,green,hazard,phase,requires,spring
S-1435	Spring timers require sustained horizon and reset on snap.	horizon,require,reset,snap,spring,sustained,timers
S-1436	Spring artifacts include action ledger, refusal cards, hinge previews, Omega updates, and transport spot checks.	action,artifacts,cards,checks,hinge,include,ledger,omega,previews,refusal,spot,spring,transport,updates
S-1437	Spring typical Theta includes mute, symmetry, phase-band, eligibility/hazard, and Lyapunov failures.	eligibility,failures,hazard,includes,lyapunov,mute,phase-band,spring,symmetry,theta,typical
S-1438	Summer handles commit-or-refuse and transport-only fallback.	commit-or-refuse,fallback,handles,summer,transport-only
S-1439	Summer requires hinge panel slope/R^2/mirror checks.	checks,hinge,mirror,panel,requires,slope,summer
S-1440	Summer requires transport spread <=0.01 and key interval equivalence.	01,equivalence,interval,key,requires,spread,summer,transport
S-1441	Summer requires full Delta-Subtractive battery and E4 pooling with thinning/down-set.	battery,delta-subtractive,down-set,e4,full,pooling,requires,summer,thinning
S-1442	Summer requires final Delta-Energy trace without bumps.	bumps,delta-energy,final,requires,summer,trace,without
S-1443	Summer includes optional H-infinity dossier for family identity claims.	claims,dossier,family,h-infinity,identity,includes,optional,summer
S-1444	Summer requires commit timer elapsed with overlays green.	commit,elapsed,green,overlays,requires,summer,timer
S-1445	Summer artifacts include certificate or Theta witness, pooling plots, detune profiles, key overlaps, and PCO signatures.	artifacts,certificate,detune,include,key,overlaps,pco,plots,pooling,profiles,signatures,summer,theta,witness
S-1446	Summer typical Theta includes band miss, swap/transport, off-ratio, boundary/topology, memory/brittleness, RG/LOW, Lyapunov, or H-infinity failures.	band,boundary,brittleness,failures,h-infinity,includes,low,lyapunov,memory,miss,off-ratio,rg,summer,swap,theta,topology,transport,typical
S-1447	Receipts-per-season legend enforces hats/3DL single quantization and fixed guards/timers.	3dl,enforces,fixed,guards,hats,legend,quantization,receipts-per-season,single,timers
S-1448	Theta refusals are append-only and absorbing at same tolerance signature.	absorbing,append-only,refusals,same,signature,theta,tolerance
S-1449	CPL is the runtime state surface on three hat-valued axes: Contrast, Phase, and Luminality.	axes,contrast,cpl,hat-valued,luminality,phase,runtime,state,surface,three
S-1450	CPL is evaluated on the 3DL lattice.	3dl,cpl,evaluated,lattice
S-1451	Fixed bands partition CPL into a Fourfold Exit Map.	bands,cpl,exit,fixed,fourfold,map,partition
S-1452	Fourfold exits are Corridor-to-Soliton, Corridor-Only, Cavitation, and Abstention.	abstention,cavitation,corridor-only,corridor-to-soliton,exits,fourfold
S-1453	No exits outside the Fourfold map are lawful.	exits,fourfold,lawful,map,no,outside
S-1454	CPL is enforced by Hazard Gates, LOW, SHR order, and E-audits.	cpl,e-audits,enforced,gates,hazard,low,order,shr
S-1455	Each window maps to a single quantized point (C,P,L).	each,maps,point,quantized,single,window
S-1456	Bands and walls on CPL are fixed and cannot widen mid-run.	bands,cannot,cpl,fixed,mid-run,walls,widen
S-1457	CPL purpose is to route Snap/Hold/Release and lock-vs-refusal decisions.	cpl,decisions,hold,lock-vs-refusal,purpose,release,route,snap
S-1458	Contrast axis measures normalized post-null structure against background.	against,axis,background,contrast,measures,normalized,post-null,structure
S-1459	Phase axis measures wrapped phase error relative to low-order relation and hinge corridor.	axis,corridor,error,hinge,low-order,measures,phase,relation,relative,wrapped
S-1460	Luminality axis measures permission-to-act from eligibility, hazard, and bandwidth budget.	axis,bandwidth,budget,eligibility,hazard,luminality,measures,permission-to-act
S-1461	CPL combines eligibility legality, phase legality, hazard budget, and null-robust contrast on one canvas.	budget,canvas,combines,contrast,cpl,eligibility,hazard,legality,null-robust,one,phase
S-1462	CPL enforces finite reproducible exits under fixed CRL/3DL bands.	3dl,bands,cpl,crl,enforces,exits,finite,fixed,reproducible,under
S-1463	Off-eligibility phase forcing is geometrically illegal in CPL.	cpl,forcing,geometrically,illegal,off-eligibility,phase
S-1464	Amplitude-only contrast illusions are illegal CPL regions.	amplitude-only,contrast,cpl,illegal,illusions,regions
S-1465	CPL inputs include coherence K, bandwidth Gamma, capture gap epsilon, phase error e_phi, contrast statistic C, and hazard H.	bandwidth,capture,coherence,contrast,cpl,e_phi,epsilon,error,gamma,gap,hazard,include,inputs,phase,statistic
S-1466	Capture gap epsilon is [2piK-Gamma]_+.	2pik-gamma,capture,epsilon,gap
S-1467	C axis is reported as binned post-null effect with confidence intervals.	axis,binned,confidence,effect,intervals,post-null,reported
S-1468	P axis is distance to phase corridor including hinge status.	axis,corridor,distance,hinge,including,phase,status
S-1469	L axis is monotone in epsilon and decreasing in hazard.	axis,decreasing,epsilon,hazard,monotone
S-1470	L>0 iff eligibility is open and hazard is below cap.	below,cap,eligibility,hazard,iff,open
S-1471	C/P/L thresholds are theory constants declared in run-card.	constants,declared,run-card,theory,thresholds
S-1472	Fourfold routing requires SHR precedence Frequency->Phase->Amplitude->Space.	amplitude-,fourfold,frequency-,phase-,precedence,requires,routing,shr,space
S-1473	Corridor-to-Soliton requires C in commit band, P in phase band, and L>0.	band,commit,corridor-to-soliton,phase,requires
S-1474	Corridor-to-Soliton requires hinge passes.	corridor-to-soliton,hinge,passes,requires
S-1475	Corridor-to-Soliton allows legal one phase snap if needed.	allows,corridor-to-soliton,if,legal,needed,one,phase,snap
S-1476	Corridor-to-Soliton allows bounded amplitude reweighting.	allows,amplitude,bounded,corridor-to-soliton,reweighting
S-1477	Corridor-to-Soliton allows optional space edits only if order and brittleness decrease.	allows,brittleness,corridor-to-soliton,decrease,edits,if,only,optional,order,space
S-1478	Corridor-to-Soliton requires Delta-Subtractive, audits, and optional H-infinity before lock publication.	audits,before,corridor-to-soliton,delta-subtractive,h-infinity,lock,optional,publication,requires
S-1479	Corridor-Only requires P in band and L>0 with C below commit band.	band,below,commit,corridor-only,requires
S-1480	Corridor-Only allows transport without commit.	allows,commit,corridor-only,transport,without
S-1481	Corridor-Only retains transport keys and continues merge.	continues,corridor-only,keys,merge,retains,transport
S-1482	Corridor-Only amplitude edits must remain reversible.	amplitude,corridor-only,edits,must,remain,reversible
S-1483	Corridor-Only space edits allowed only with order/brittleness reduction.	allowed,brittleness,corridor-only,edits,only,order,reduction,space
S-1484	Cavitation triggers with high C and bad P.	bad,cavitation,high,triggers
S-1485	Cavitation triggers with L<=0 during destabilized high-contrast state.	cavitation,destabilized,during,high-contrast,state,triggers
S-1486	Cavitation triggers immediate demotion to Theta with typed witness.	cavitation,demotion,immediate,theta,triggers,typed,witness
S-1487	Cavitation requires undo of provisional amplitude edits.	amplitude,cavitation,edits,provisional,requires,undo
S-1488	Cavitation freezes space edits.	cavitation,edits,freezes,space
S-1489	Abstention triggers when L<=0.	abstention,triggers,when
S-1490	Abstention also applies when C below detect and P not in band.	abstention,also,applies,band,below,detect,not,when
S-1491	Abstention allows measurement only.	abstention,allows,measurement,only
S-1492	Micro-nudges under abstention must be inert.	abstention,inert,micro-nudges,must,under
S-1493	Score-with-failed-gates is an invalid region.	invalid,region,score-with-failed-gates
S-1494	CPL invariant requires single 3DL quantization before all axis/band evaluations.	3dl,all,axis,band,before,cpl,evaluations,invariant,quantization,requires,single
S-1495	Sub-CRL flips are inert and inadmissible in CPL routing.	cpl,flips,inadmissible,inert,routing,sub-crl
S-1496	Eligibility wall forbids phase/amplitude edits when L<=0.	amplitude,edits,eligibility,forbids,phase,wall,when
S-1497	Phase honesty requires mute-survival; amplitude cannot fabricate phase evidence.	amplitude,cannot,evidence,fabricate,honesty,mute-survival,phase,requires
S-1498	LOW corridor invariant requires exits #1 and #2 to survive pooling with thinning/down-set.	corridor,down-set,exits,invariant,low,pooling,requires,survive,thinning
S-1499	One-snap invariant allows at most one phase snap per window.	allows,invariant,most,one,one-snap,per,phase,snap,window
S-1500	Audit supremacy means E-audits and Delta-Subtractive outrank S* scores.	audit,delta-subtractive,e-audits,means,outrank,scores,supremacy
S-1501	CPL evidence includes C-P-L trajectories with region shading and per-window labels.	c-p-l,cpl,evidence,includes,labels,per-window,region,shading,trajectories
S-1502	CPL evidence includes explicit band contracts with confidence bars.	band,bars,confidence,contracts,cpl,evidence,explicit,includes
S-1503	CPL evidence includes action ledger aligned to CPL movement.	action,aligned,cpl,evidence,includes,ledger,movement
S-1504	CPL evidence includes hinge/mirror receipts at corridor-to-soliton boundary.	boundary,corridor-to-soliton,cpl,evidence,hinge,includes,mirror,receipts
S-1505	CPL evidence includes subtractive and audit outcomes attached to #1 exits.	attached,audit,cpl,evidence,exits,includes,outcomes,subtractive
S-1506	CPL evidence includes hazard timeline showing L>0 only at lawful actions.	actions,cpl,evidence,hazard,includes,lawful,only,showing,timeline
S-1507	CPL evidence includes typed refusal witnesses for #3 and #4 exits.	cpl,evidence,exits,includes,refusal,typed,witnesses
S-1508	CPL falsifier is ungated accepted phase/amplitude edit with L<=0.	accepted,amplitude,cpl,edit,falsifier,phase,ungated
S-1509	CPL falsifier is corridor-to-soliton claim failing mute-survival.	claim,corridor-to-soliton,cpl,failing,falsifier,mute-survival
S-1510	CPL falsifier is no pooling survival for #1/#2 exits.	cpl,exits,falsifier,no,pooling,survival
S-1511	CPL falsifier is exit-class flip under admissible meter swap with co-located hats.	admissible,co-located,cpl,exit-class,falsifier,flip,hats,meter,swap,under
S-1512	CPL falsifier is sub-CRL-only leverage for exit existence.	cpl,existence,exit,falsifier,leverage,sub-crl-only
S-1513	CPL methods must declare definitions of C,P,L and report as lattice counts.	counts,cpl,declare,definitions,lattice,methods,must,report
S-1514	CPL methods must bind to SHR and gates with frequency opening L>0 before phase.	before,bind,cpl,frequency,gates,methods,must,opening,phase,shr
S-1515	CPL methods must enforce phase-in-band before amplitude.	amplitude,before,cpl,enforce,methods,must,phase-in-band
S-1516	CPL methods must enforce one snap per window.	cpl,enforce,methods,must,one,per,snap,window
S-1517	CPL methods must publish shaded four-region exit map with inequalities.	cpl,exit,four-region,inequalities,map,methods,must,publish,shaded
S-1518	CPL methods must log each window exit tag and action ledger.	action,cpl,each,exit,ledger,log,methods,must,tag,window
S-1519	CPL methods must run subtractive and E-audits on #1 exits before promotion.	before,cpl,e-audits,exits,methods,must,promotion,run,subtractive
S-1520	CPL methods must attach pooling/thinning plots before promotion.	attach,before,cpl,methods,must,plots,pooling,promotion,thinning
S-1521	CPL methods must optionally attach H-infinity dossier for locks.	attach,cpl,dossier,h-infinity,locks,methods,must,optionally
S-1522	CPL methods must publish refusal ledger for #3/#4 as binding constraints.	binding,constraints,cpl,ledger,methods,must,publish,refusal
S-1523	Corridor is a maximal connected CPL set with P in band and L>0.	band,connected,corridor,cpl,maximal,set
S-1524	Corridor may have contrast below commit band.	band,below,commit,contrast,corridor,have,may
S-1525	Corridor corresponds to Exit #2 or pre-commit segment of Exit #1.	corresponds,corridor,exit,pre-commit,segment
S-1526	Corridor is constrained to LOW routes and hazard-safe regions.	constrained,corridor,hazard-safe,low,regions,routes
S-1527	Corridor is certified by transport keys rather than lock certificate.	certificate,certified,corridor,keys,lock,rather,than,transport
S-1528	Filament is piecewise-dyadic concatenation of adjacent corridors.	adjacent,concatenation,corridors,filament,piecewise-dyadic
S-1529	Filament must survive x2/x4 pooling with integer thinning.	filament,integer,must,pooling,survive,thinning,x2,x4
S-1530	Filament requires bounded order and brittleness across concatenation.	across,bounded,brittleness,concatenation,filament,order,requires
S-1531	Filament requires eligibility-open handoff points.	eligibility-open,filament,handoff,points,requires
S-1532	Filament Family is H-infinity equivalence class of filaments.	class,equivalence,family,filament,filaments,h-infinity
S-1533	Family equivalence requires transport-key symmetric difference approximately zero.	approximately,difference,equivalence,family,requires,symmetric,transport-key,zero
S-1534	Family equivalence requires receipt invariants in-band across portability sweep.	across,equivalence,family,in-band,invariants,portability,receipt,requires,sweep
S-1535	A lock may lie on a filament.	filament,lie,lock,may
S-1536	Filaments can exist without any commit lock.	any,can,commit,exist,filaments,lock,without
S-1537	Locks carry certificates; corridors/filaments carry transport key dossiers.	carry,certificates,corridors,dossiers,filaments,key,locks,transport
S-1538	Filament points can elevate to lock when C enters commit band and all guards pass.	all,band,can,commit,elevate,enters,filament,guards,lock,pass,points,when
S-1539	Corridor/filament model captures lawful structure beyond immediate commits.	beyond,captures,commits,corridor,filament,immediate,lawful,model,structure
S-1540	Planners use filaments for hazard-safe low-order routing.	filaments,hazard-safe,low-order,planners,routing,use
S-1541	Outside filaments correct action is abstention.	abstention,action,correct,filaments,outside
S-1542	Corridor detection computes CPL state on hats at 3DL.	3dl,computes,corridor,cpl,detection,hats,state
S-1543	Corridor condition requires phase in band and L>0 with LOW corridor respect.	band,condition,corridor,low,phase,requires,respect
S-1544	Corridor transport checks require slope-1, mirror pass, and meter spread <=0.01.	01,checks,corridor,meter,mirror,pass,require,slope-1,spread,transport
S-1545	Corridor checks require detune discipline with lock band and monotone off-ratio.	band,checks,corridor,detune,discipline,lock,monotone,off-ratio,require
S-1546	Corridor checks require hazard below cap and epsilon>0 at phase/amplitude actions.	actions,amplitude,below,cap,checks,corridor,epsilon,hazard,phase,require
S-1547	Corridor checks enforce one-snap rule.	checks,corridor,enforce,one-snap,rule
S-1548	Filament assembly concatenates adjacent corridor windows with overlapping transport keys.	adjacent,assembly,concatenates,corridor,filament,keys,overlapping,transport,windows
S-1549	Filament assembly requires green eligibility handoffs.	assembly,eligibility,filament,green,handoffs,requires
S-1550	Filament assembly runs x2 pooling and prunes LOW inversions.	assembly,filament,inversions,low,pooling,prunes,runs,x2
S-1551	Filament assembly across contexts requires decision parity and spread band preservation.	across,assembly,band,contexts,decision,filament,parity,preservation,requires,spread
S-1552	Family certification runs H-infinity portability sweeps.	certification,family,h-infinity,portability,runs,sweeps
S-1553	Family pass requires key identity preservation under admissible perturbations.	admissible,family,identity,key,pass,perturbations,preservation,requires,under
S-1554	Family pass requires no hazard breaches and no leadership flips.	breaches,family,flips,hazard,leadership,no,pass,requires
S-1555	Family label includes order/support signature, key hash, and RG/H receipts.	family,hash,includes,key,label,order,receipts,rg,signature,support
S-1556	Corridor evidence includes CPL card with bands and eligibility-hazard traces.	bands,card,corridor,cpl,eligibility-hazard,evidence,includes,traces
S-1557	Corridor evidence includes hinge/mirror and meter-spread panels.	corridor,evidence,hinge,includes,meter-spread,mirror,panels
S-1558	Key evidence includes per-axis intervals with overlap confidence intervals.	confidence,evidence,includes,intervals,key,overlap,per-axis
S-1559	RG evidence includes thinning slopes and down-set survivor plots.	down-set,evidence,includes,plots,rg,slopes,survivor,thinning
S-1560	Handoff evidence logs eligible concatenation windows and one-snap compliance.	compliance,concatenation,eligible,evidence,handoff,logs,one-snap,windows
S-1561	H family evidence shows identity preservation under admissible sweeps.	admissible,evidence,family,identity,preservation,shows,sweeps,under
S-1562	Representative windows require null and meter-swap subtractive spot-checks.	meter-swap,null,representative,require,spot-checks,subtractive,windows
S-1563	Corridor/filament invariants require CRL/3DL-only values after single quantization.	3dl-only,after,corridor,crl,filament,invariants,quantization,require,single,values
S-1564	Eligibility wall forbids phase/amplitude edits when L<=0 or epsilon<=0.	amplitude,edits,eligibility,epsilon,forbids,phase,wall,when
S-1565	Audit supremacy brackets edits with E1/E2 and requires E4 for filament status.	audit,brackets,e1,e2,e4,edits,filament,requires,status,supremacy
S-1566	LOW corridor invariant prunes high-order detours lacking thinning.	corridor,detours,high-order,invariant,lacking,low,prunes,thinning
S-1567	One-snap invariant remains active per window.	active,invariant,one-snap,per,remains,window
S-1568	No band drift is allowed within run-card; changes require version rev and recertification.	allowed,band,changes,drift,no,recertification,require,rev,run-card,version,within
S-1569	Lock decision is binary commit; corridor/filament decision is transport reality.	binary,commit,corridor,decision,filament,lock,reality,transport
S-1570	Lock artifacts are certificate-centric; filament artifacts are key/dossier-centric.	artifacts,certificate-centric,dossier-centric,filament,key,lock
S-1571	Filament failure can shrink keys or escalate to Theta when guards break.	break,can,escalate,failure,filament,guards,keys,shrink,theta,when
S-1572	Locks instantiate objects; filaments route lawful motion and predict safe commit zones.	commit,filaments,instantiate,lawful,locks,motion,objects,predict,route,safe,zones
S-1573	Corridor/filament falsifier is meter dependence with spread >0.01 or hinge miss.	01,corridor,dependence,falsifier,filament,hinge,meter,miss,spread
S-1574	Corridor/filament falsifier is RG inversion after pooling.	after,corridor,falsifier,filament,inversion,pooling,rg
S-1575	Corridor/filament falsifier is off-eligibility concatenation or snap.	concatenation,corridor,falsifier,filament,off-eligibility,snap
S-1576	Corridor/filament falsifier is H-infinity identity break under admissible sweep.	admissible,break,corridor,falsifier,filament,h-infinity,identity,sweep,under
S-1577	Corridor/filament falsifier is non-collapsing off-ratio ladder near boundaries.	boundaries,corridor,falsifier,filament,ladder,near,non-collapsing,off-ratio
S-1578	Corridor/filament falsifier is mid-run band drift.	band,corridor,drift,falsifier,filament,mid-run
S-1579	Any corridor/filament falsifier causes demotion, pruning, break, or Theta.	any,break,causes,corridor,demotion,falsifier,filament,pruning,theta
S-1580	Methods must declare run-card bands, meters, windows, and order caps.	bands,caps,declare,meters,methods,must,order,run-card,windows
S-1581	Methods must detect corridors via CPL+hinge/mirror+swap+detune with eligibility-hazard logs.	corridors,cpl,detect,detune,eligibility-hazard,hinge,logs,methods,mirror,must,swap,via
S-1582	Methods must assemble filaments by key overlap and verify handoffs.	assemble,filaments,handoffs,key,methods,must,overlap,verify
S-1583	Methods must run x2 pooling and publish thinning/down-set geometry.	down-set,geometry,methods,must,pooling,publish,run,thinning,x2
S-1584	Methods must certify family via H-infinity sweeps and key equivalence.	certify,equivalence,family,h-infinity,key,methods,must,sweeps,via
S-1585	Methods must ship corridor cards, key intervals, RG/H panels, and refusal ledger.	cards,corridor,intervals,key,ledger,methods,must,panels,refusal,rg,ship
S-1586	Promotion rule elevates corridor point to lock only after subtractive+audits pass.	after,audits,corridor,elevates,lock,only,pass,point,promotion,rule,subtractive
S-1587	H-infinity is post-lock portability and stability harness.	h-infinity,harness,portability,post-lock,stability
S-1588	H-infinity proves lock survives admissible perturbations on CRL hats.	admissible,crl,h-infinity,hats,lock,perturbations,proves,survives
S-1589	H-infinity requires bounded worst-case disturbance-to-output gain.	bounded,disturbance-to-output,gain,h-infinity,requires,worst-case
S-1590	Default H-infinity wall is gamma_star = 1.	default,gamma_star,h-infinity,wall
S-1591	H-infinity gains and thresholds are reported as lattice counts on hats.	counts,gains,h-infinity,hats,lattice,reported,thresholds
S-1592	H-infinity runs after GML and does not create locks.	after,create,does,gml,h-infinity,locks,not,runs
S-1593	H-infinity certifies transportability across meters/scales within declared uncertainty.	across,certifies,declared,h-infinity,meters,scales,transportability,uncertainty,within
S-1594	H-infinity prevents lab-only lock illusions.	h-infinity,illusions,lab-only,lock,prevents
S-1595	H-infinity ties stability to CRL objectivity and blocks sub-CRL games.	blocks,crl,games,h-infinity,objectivity,stability,sub-crl,ties
S-1596	H-infinity completes stack after LOW, pins, and hinges.	after,completes,h-infinity,hinges,low,pins,stack
S-1597	H-infinity sweep starts from published locked key and receipts.	h-infinity,key,locked,published,receipts,starts,sweep
S-1598	Perturbation set w includes meter swap, band/window shuffle, dyadic shifts, null/placebo, and bounded load jitter.	band,bounded,dyadic,includes,jitter,load,meter,null,perturbation,placebo,set,shifts,shuffle,swap,window
S-1599	Outcome set z includes hinge spread, mirror-overlap deltas, hazard surplus, and closure drift.	closure,deltas,drift,hazard,hinge,includes,mirror-overlap,outcome,set,spread,surplus
S-1600	For each perturbation compute ||z||2/||w||2 on CRL lattice.	compute,crl,each,lattice,perturbation
S-1601	H-infinity decision uses worst-case sup gain across admissible perturbations.	across,admissible,decision,gain,h-infinity,perturbations,sup,uses,worst-case
S-1602	H-infinity passes when sup gain <=1 and key identity is unchanged.	gain,h-infinity,identity,key,passes,sup,unchanged,when
S-1603	H-infinity failure yields Theta<H> with typed witness.	failure,h-infinity,theta,typed,witness,yields
S-1604	Hats-first CRL-only invariant applies to both w and z.	applies,both,crl-only,hats-first,invariant
S-1605	Sub-CRL differences are causally inert in H.	causally,differences,inert,sub-crl
S-1606	H pass requires no key drift in labels or overlap/mirror tables.	drift,key,labels,mirror,no,overlap,pass,requires,tables
S-1607	Any hazard push above Hc causes immediate Theta regardless of gain.	above,any,causes,gain,hazard,hc,immediate,push,regardless,theta
S-1608	H failure is absorbing; reassessment requires new receipts.	absorbing,failure,new,reassessment,receipts,requires
S-1609	H evidence includes declared harness definition and typed failure witnesses.	declared,definition,evidence,failure,harness,includes,typed,witnesses
