id	statement	keywords
S-1034	The hidden assumption that numbers are abstract-first is rejected.	abstract-first,assumption,hidden,numbers,rejected
S-1035	The corrected claim is that numbers emerge from physical-lock structure with no free degrees of freedom.	claim,corrected,degrees,emerge,free,freedom,no,numbers,physical-lock,structure
S-1036	The framework claims two independent derivations converge on the same survivor set.	claims,converge,derivations,framework,independent,same,set,survivor,two
S-1037	Existence requires contrast.	contrast,existence,requires
S-1038	Contrast requires at least two distinguishable states.	contrast,distinguishable,least,requires,states,two
S-1039	Two states are the minimum for distinguishability between absence and presence.	absence,between,distinguishability,minimum,presence,states,two
S-1040	The two primitive states are represented as 0 and 1.	primitive,represented,states,two
S-1041	All binary oppositions are instances of the same underlying two-state distinction.	all,binary,distinction,instances,oppositions,same,two-state,underlying
S-1042	From two states, first-order pair combinations are exactly four.	combinations,exactly,first-order,four,pair,states,two
S-1043	The four binary pairs are 00, 01, 10, and 11.	00,01,10,11,binary,four,pairs
S-1044	Quaternary logic is treated as first-order self-relation of reality.	first-order,logic,quaternary,reality,self-relation,treated
S-1045	Pairwise relation of four primitives yields a 4x4 grid of sixteen positions.	4x4,four,grid,pairwise,positions,primitives,relation,sixteen,yields
S-1046	Base-4 lattice with Manhattan adjacency has unique topological behavior compared to diagonal or triangular alternatives.	adjacency,alternatives,base-4,behavior,compared,diagonal,has,lattice,manhattan,topological,triangular,unique
S-1047	In N=4 cardinal adjacency, top and right neighbors do not touch directly and require corner traversal.	adjacency,cardinal,corner,directly,do,neighbors,not,require,right,top,touch,traversal
S-1048	The minimal closed walk around an interior cell in this geometry has length 8.	around,cell,closed,geometry,has,interior,length,minimal,walk
S-1049	Eight-step minimum loop is a load-bearing property for confinement and locking.	confinement,eight-step,load-bearing,locking,loop,minimum,property
S-1050	Four-step enclosure in diagonal N=8 connectivity collapses this protective property.	collapses,connectivity,diagonal,enclosure,four-step,property,protective
S-1051	Triangular alternatives alter parity and loop structure away from the observed constraint pattern.	alter,alternatives,away,constraint,loop,observed,parity,pattern,structure,triangular
S-1052	N=4 is claimed as unique for enforcing even cycles with 8-step loop minimum.	8-step,claimed,cycles,enforcing,even,loop,minimum,unique
S-1053	The 3:2 hinge is presented as minimal turn ratio between freedom and constraint in N=4 geometry.	between,constraint,freedom,geometry,hinge,minimal,presented,ratio,turn
S-1054	Corner traversal is structurally required for loop closure in L1 geometry.	closure,corner,geometry,l1,loop,required,structurally,traversal
S-1055	Corners correspond to extreme base-4 states 00, 03, 30, and 33.	00,03,30,33,base-4,corners,correspond,extreme,states
S-1056	Corners are boundary positions that function as required connectors for closure.	boundary,closure,connectors,corners,function,positions,required
S-1057	Zero is identified with address 00 as primordial abstention.	00,abstention,address,identified,primordial,zero
S-1058	Zero is treated as structural infrastructure rather than post-hoc counting symbol.	counting,infrastructure,post-hoc,rather,structural,symbol,than,treated,zero
S-1059	Survivors depend on abstentions for stability.	abstentions,depend,stability,survivors
S-1060	The loop closure requires passing through void positions.	closure,loop,passing,positions,requires,through,void
S-1061	Six grid positions fail structurally.	fail,grid,positions,six,structurally
S-1062	Corner failures are extreme boundary states without sustaining interior contrast.	boundary,contrast,corner,extreme,failures,interior,states,sustaining,without
S-1063	Diagonal failures are self-pairing states with no new contrast generation.	contrast,diagonal,failures,generation,new,no,self-pairing,states
S-1064	After removing six failures from sixteen positions, ten survivors remain.	after,failures,positions,remain,removing,six,sixteen,survivors,ten
S-1065	The ten survivors are addresses {1,2,4,6,7,8,9,11,13,14}.	11,13,14,addresses,survivors,ten
S-1066	N=1 yields zero survivors in the listed sweep.	listed,survivors,sweep,yields,zero
S-1067	N=2 yields zero survivors in the listed sweep.	listed,survivors,sweep,yields,zero
S-1068	N=3 yields four survivors in the listed sweep.	four,listed,survivors,sweep,yields
S-1069	N=4 yields ten survivors in the listed sweep.	listed,survivors,sweep,ten,yields
S-1070	N>4 produces larger survivor counts not used as natural base systems in this argument.	argument,base,counts,larger,natural,not,produces,survivor,systems,used
S-1071	N=4 is claimed as first generative phase transition with interior bulk.	bulk,claimed,first,generative,interior,phase,transition
S-1072	A second derivation maps 4x4 positions to 4-bit strings.	4-bit,4x4,derivation,maps,positions,second,strings
S-1073	The sixteen lattice positions are equivalent to sixteen 4-bit configurations.	4-bit,configurations,equivalent,lattice,positions,sixteen
S-1074	Computational stability is tested via traversal and shear gates.	computational,gates,shear,stability,tested,traversal,via
S-1075	Gate A forbids paradox loops requiring back-jumps in monotone ONAL traversal.	back-jumps,forbids,gate,loops,monotone,onal,paradox,requiring,traversal
S-1076	Gate A rejects alternating strings 0101 and 1010.	0101,1010,alternating,gate,rejects,strings
S-1077	Gate B forbids concentrated shear where full transition occurs at one step.	concentrated,forbids,full,gate,occurs,one,shear,step,transition,where
S-1078	Gate B rejects 0011 and 1100.	0011,1100,gate,rejects
S-1079	Uniform strings 0000 and 1111 are rejected for no contrast.	0000,1111,contrast,no,rejected,strings,uniform
S-1080	The two gates plus uniform rejection remove six configurations.	configurations,gates,plus,rejection,remove,six,two,uniform
S-1081	Rejected strings map to the same six corner/diagonal addresses as geometric exclusion.	addresses,corner,diagonal,exclusion,geometric,map,rejected,same,six,strings
S-1082	Independent geometric and computational derivations converge on the same six failures.	computational,converge,derivations,failures,geometric,independent,same,six
S-1083	Ten survivors remain under both derivation routes.	both,derivation,remain,routes,survivors,ten,under
S-1084	Among survivors, 0110 and 1001 are apex balanced weight-2 configurations.	0110,1001,among,apex,balanced,configurations,survivors,weight-2
S-1085	0110 and 1001 are bitwise complements and topological mirrors.	0110,1001,bitwise,complements,mirrors,topological
S-1086	Their decimal addresses are 6 and 9.	addresses,decimal,their
S-1087	Six is linked to hexagonal constructibility and planar tessellation stability.	constructibility,hexagonal,linked,planar,six,stability,tessellation
S-1088	Nine is linked to nonagon non-constructibility by compass-straightedge in this framing.	compass-straightedge,framing,linked,nine,non-constructibility,nonagon
S-1089	Hexagon and nonagon coexistence in shared-side planar setup leaves a 100-degree gap.	100-degree,coexistence,gap,hexagon,leaves,nonagon,planar,setup,shared-side
S-1090	The 100-degree gap is presented as unfillable by regular polygons.	100-degree,gap,polygons,presented,regular,unfillable
S-1091	Computation and Euclidean constructibility are claimed to mark boundary closure simultaneously at 6/9.	boundary,claimed,closure,computation,constructibility,euclidean,mark,simultaneously
S-1092	System continuation after survivor exhaustion requires wrap.	after,continuation,exhaustion,requires,survivor,system,wrap
S-1093	Wrap notation is represented as 10.	10,notation,represented,wrap
S-1094	Ten is interpreted as first survivor beside primordial void at next magnitude cycle.	beside,cycle,first,interpreted,magnitude,next,primordial,survivor,ten,void
S-1095	Zero is treated as prerequisite infrastructure for positional extension.	extension,infrastructure,positional,prerequisite,treated,zero
S-1096	Powers of ten are described as repeated return-to-void structure.	described,powers,repeated,return-to-void,structure,ten
S-1097	Digits are interpreted as enumerated survivor ordering rather than direct lattice addresses.	addresses,digits,direct,enumerated,interpreted,lattice,ordering,rather,survivor,than
S-1098	Digit 3 is claimed to denote third survivor in ordered stable path, not lattice address 3.	address,claimed,denote,digit,lattice,not,ordered,path,stable,survivor,third
S-1099	Number line is treated as renormalized traversal through stable bulk with holes skipped.	bulk,holes,line,number,renormalized,skipped,stable,through,traversal,treated
S-1100	Counting advances only across persistent survivors.	across,advances,counting,only,persistent,survivors
S-1101	Ten symbols are required to enumerate the ten survivor positions.	enumerate,positions,required,survivor,symbols,ten
S-1102	The notation 10 is interpreted as diagrammatic cycle boundary marker.	10,boundary,cycle,diagrammatic,interpreted,marker,notation
S-1103	6 and 9 are treated as pre-wrap limit markers in this narrative.	limit,markers,narrative,pre-wrap,treated
S-1104	The closure loop is existence->binary->quaternary->16-grid->6-failure->10-survivor->wrap.	10-survivor-,16-grid-,6-failure-,binary-,closure,existence-,loop,quaternary-,wrap
S-1105	The framework claims fixed-point self-consistency without external foundations.	claims,external,fixed-point,foundations,framework,self-consistency,without
S-1106	The claim is that no unbounded reference is required in the closed derivation.	claim,closed,derivation,no,reference,required,unbounded
S-1107	Wigner mystery is reframed as expected effectiveness if math is description of physical locks.	description,effectiveness,expected,if,locks,math,mystery,physical,reframed,wigner
S-1108	Arithmetic non-negotiability is attributed to geometric constraints of the lattice.	arithmetic,attributed,constraints,geometric,lattice,non-negotiability
S-1109	Division by zero is interpreted as abstention due to void interior non-addressability.	abstention,division,due,interior,interpreted,non-addressability,void,zero
S-1110	Irrational numbers are interpreted as abstention records beyond finite lattice resolution.	abstention,beyond,finite,interpreted,irrational,lattice,numbers,records,resolution
S-1111	Hexagon prevalence in nature is interpreted as LOW constructible stability attractor.	attractor,constructible,hexagon,interpreted,low,nature,prevalence,stability
S-1112	Nonagon rarity is interpreted as constructibility boundary effect.	boundary,constructibility,effect,interpreted,nonagon,rarity
S-1113	Zero behavior across operations is attributed to structural primacy of void.	across,attributed,behavior,operations,primacy,structural,void,zero
S-1114	Mathematics and physics are claimed to be the same lock-structure viewed in two representations.	claimed,lock-structure,mathematics,physics,representations,same,two,viewed
S-1115	Numbers are asserted real as substrate-stability classes.	asserted,classes,numbers,real,substrate-stability
S-1116	Number reality is claimed independent of observer preference.	claimed,independent,number,observer,preference,reality
S-1117	Digit-shape correspondence is asserted as low-order stable geometry per survivor count.	asserted,correspondence,count,digit-shape,geometry,low-order,per,stable,survivor
S-1118	One corresponds to point presence.	corresponds,one,point,presence
S-1119	Two corresponds to line relation.	corresponds,line,relation,two
S-1120	Three corresponds to triangle as minimal stable three-point form.	corresponds,form,minimal,stable,three,three-point,triangle
S-1121	Four corresponds to square in this schema.	corresponds,four,schema,square
S-1122	Five corresponds to pentagon in this schema.	corresponds,five,pentagon,schema
S-1123	Six corresponds to hexagon as constructible apex in this schema.	apex,constructible,corresponds,hexagon,schema,six
S-1124	Seven corresponds to first constructibility-break regime in this schema.	constructibility-break,corresponds,first,regime,schema,seven
S-1125	Eight corresponds to octagon in this schema.	corresponds,eight,octagon,schema
S-1126	Nine corresponds to nonagon boundary role in this schema.	boundary,corresponds,nine,nonagon,role,schema
S-1127	Zero corresponds to empty boundary circle and abstention scaffold.	abstention,boundary,circle,corresponds,empty,scaffold,zero
S-1128	Survivor addresses are non-contiguous and include abstention holes.	abstention,addresses,holes,include,non-contiguous,survivor
S-1129	Enumeration over survivors produces the decimal digit set 0-9.	0-9,decimal,digit,enumeration,over,produces,set,survivors
S-1130	The same binary distinction appears at both base and apex levels as complement pairs.	apex,appears,base,binary,both,complement,distinction,levels,pairs,same
S-1131	0/1 is primitive binary.	binary,primitive
S-1132	0110/1001 is apex distributed binary complement.	0110,1001,apex,binary,complement,distributed
S-1133	The framework closes with claim that mathematics was always already physics.	already,always,claim,closes,framework,mathematics,physics,was
S-1134	The final thesis is that counting was learned by observing what survives under structural constraints.	constraints,counting,final,learned,observing,structural,survives,thesis,under,was,what
S-1135	Void is asserted as load-bearing mortar of survivor stability.	asserted,load-bearing,mortar,stability,survivor,void
S-1136	From two states arise four combinations.	arise,combinations,four,states,two
S-1137	From four combinations arise sixteen positions.	arise,combinations,four,positions,sixteen
S-1138	From two independent analyses arise the same six exclusions.	analyses,arise,exclusions,independent,same,six,two
S-1139	From six exclusions remain ten survivors.	exclusions,remain,six,survivors,ten
S-1140	From ten survivors and void arises positional counting cycle.	arises,counting,cycle,positional,survivors,ten,void
S-1141	The loop is presented as self-supporting closure with no external postulates beyond initial contrast premise.	beyond,closure,contrast,external,initial,loop,no,postulates,premise,presented,self-supporting
S-1142	Oscillation is introduced as a diagnostic layer beyond the base problem definition.	base,beyond,definition,diagnostic,introduced,layer,oscillation,problem
S-1143	The chapter claims debates can self-test structural foundations through critique flips.	can,chapter,claims,critique,debates,flips,foundations,self-test,structural,through
S-1144	Counterexample drilling is used as method to distinguish tasks from true problems.	counterexample,distinguish,drilling,method,problems,tasks,true,used
S-1145	Drilling asks repeatedly what makes a case a problem rather than annoyance.	annoyance,asks,case,drilling,makes,problem,rather,repeatedly,than,what
S-1146	Drilling recurrently lands on bounded frame failing to close reference.	bounded,close,drilling,failing,frame,lands,recurrently,reference
S-1147	A common critique flip is from too abstract to too trivial.	abstract,common,critique,flip,too,trivial
S-1148	The two critiques are treated as opposites that cannot both hold simultaneously.	both,cannot,critiques,hold,opposites,simultaneously,treated,two
S-1149	Oscillation is defined as alternating between incompatible critiques without stable resolution.	alternating,between,critiques,defined,incompatible,oscillation,resolution,stable,without
S-1150	Oscillation is interpreted as structural signature rather than debate failure.	debate,failure,interpreted,oscillation,rather,signature,structural,than
S-1151	Oscillation indicates critique space exhaustion with no third stable position.	critique,exhaustion,indicates,no,oscillation,position,space,stable,third
S-1152	Ping-pong between two incomplete closures signals frame non-closure.	between,closures,frame,incomplete,non-closure,ping-pong,signals,two
S-1153	Oscillation is treated as foundation-contact signal.	foundation-contact,oscillation,signal,treated
S-1154	A->B->A critique flipping is used as indicator of structural limit.	a-,b-,critique,flipping,indicator,limit,structural,used
S-1155	The chapter claims oscillation appears in both mundane and high-level debates.	appears,both,chapter,claims,debates,high-level,mundane,oscillation
S-1156	Consciousness debate is presented as canonical oscillation case.	canonical,case,consciousness,debate,oscillation,presented
S-1157	Objective consciousness theories attract critique that experience is omitted.	attract,consciousness,critique,experience,objective,omitted,theories
S-1158	Subjective consciousness theories attract critique that claims are untestable.	attract,claims,consciousness,critique,subjective,theories,untestable
S-1159	The objective-subjective flip is treated as persistent oscillation loop.	flip,loop,objective-subjective,oscillation,persistent,treated
S-1160	The loop is explained as single frame over mixed bounded and unbounded references.	bounded,explained,frame,loop,mixed,over,references,single,unbounded
S-1161	A bounded scientific frame is said unable to close over unbounded first-person reference.	bounded,close,first-person,frame,over,reference,said,scientific,unable,unbounded
S-1162	Oscillation in consciousness is attributed to overloaded terminology.	attributed,consciousness,oscillation,overloaded,terminology
S-1163	The term consciousness is split into multiple hidden targets.	consciousness,hidden,multiple,split,targets,term
S-1164	Consciousness-as-experience is identified as first-person hard target.	consciousness-as-experience,first-person,hard,identified,target
S-1165	Consciousness-as-access is identified as operationally testable target.	consciousness-as-access,identified,operationally,target,testable
S-1166	Consciousness-as-self-model is identified as architecturally testable target.	architecturally,consciousness-as-self-model,identified,target,testable
S-1167	Consciousness-as-wakefulness is identified as clinical measurable target.	clinical,consciousness-as-wakefulness,identified,measurable,target
S-1168	Using one word for four targets drives unresolved debate churn.	churn,debate,drives,four,one,targets,unresolved,using,word
S-1169	Argument participants often switch target senses without noticing.	argument,noticing,often,participants,senses,switch,target,without
S-1170	Mixing bounded and unbounded senses inside one label prevents closure.	bounded,closure,inside,label,mixing,one,prevents,senses,unbounded
S-1171	Oscillation is proposed as scale-invariant across domains.	across,domains,oscillation,proposed,scale-invariant
S-1172	Oscillation can appear in editing micro-decisions and centuries-long philosophy.	appear,can,centuries-long,editing,micro-decisions,oscillation,philosophy
S-1173	The diagnostic move is to detect dual critiques that reciprocally negate.	critiques,detect,diagnostic,dual,move,negate,reciprocally
S-1174	When only reciprocal critiques remain, foundation is reached.	critiques,foundation,only,reached,reciprocal,remain,when
S-1175	Foundation here means structural boundary, not final answer.	answer,boundary,final,foundation,here,means,not,structural
S-1176	The chapter recommends not choosing sides inside oscillation by default.	chapter,choosing,default,inside,not,oscillation,recommends,sides
S-1177	Resolution move is to identify unbounded reference explicitly.	explicitly,identify,move,reference,resolution,unbounded
S-1178	Resolution options are cut, bound, or acknowledge structural limit.	acknowledge,bound,cut,limit,options,resolution,structural
S-1179	Closure operator must be declared explicitly.	closure,declared,explicitly,must,operator
S-1180	Statements should separate solvable-under-definition from ungroundable-outside-definition.	separate,should,solvable-under-definition,statements,ungroundable-outside-definition
S-1181	This split is framed as precision rather than dodge.	dodge,framed,precision,rather,split,than
S-1182	Oscillation-aware framing enables testable and falsifiable progress.	enables,falsifiable,framing,oscillation-aware,progress,testable
S-1183	Failure to reframe yields century-scale argument loops.	argument,century-scale,failure,loops,reframe,yields
S-1184	The chapter links successful structural resolutions to explicit boundary setting.	boundary,chapter,explicit,links,resolutions,setting,structural,successful
S-1185	The oscillation diagnostic is applicable to theology, politics, art, and language disputes.	applicable,art,diagnostic,disputes,language,oscillation,politics,theology
S-1186	Oscillation presence suggests hidden multi-reference overload.	hidden,multi-reference,oscillation,overload,presence,suggests
S-1187	Two-critique alternation is treated as signature of non-closable framing.	alternation,framing,non-closable,signature,treated,two-critique
S-1188	A stable middle position absence is key oscillation criterion.	absence,criterion,key,middle,oscillation,position,stable
S-1189	Each critique flip is interpreted as tacit failure of prior closure.	closure,critique,each,failure,flip,interpreted,prior,tacit
S-1190	Oscillation is not proof of either side's correctness.	correctness,either,not,oscillation,proof,side
S-1191	Oscillation is evidence of frame-reference mismatch.	evidence,frame-reference,mismatch,oscillation
S-1192	The chapter distinguishes skeleton-level structure from costume-level examples.	chapter,costume-level,distinguishes,examples,skeleton-level,structure
S-1193	Foundation detection precedes answer construction.	answer,construction,detection,foundation,precedes
S-1194	The operational stop condition is explicit closure policy.	closure,condition,explicit,operational,policy,stop
S-1195	Bounded references should be isolated and solved directly.	bounded,directly,isolated,references,should,solved
S-1196	Unbounded references should be bounded or quarantined as limits.	bounded,limits,quarantined,references,should,unbounded
S-1197	The chapter positions this as next-step gateway to method chapters.	chapter,chapters,gateway,method,next-step,positions
S-1198	Counterexample handling should drill to operator failure, not surface label.	counterexample,drill,failure,handling,label,not,operator,should,surface
S-1199	A flat tire can be task or problem depending on closure space state.	can,closure,depending,flat,problem,space,state,task,tire
S-1200	Resolution-space fracture is treated as trigger of problem status.	fracture,problem,resolution-space,status,treated,trigger
S-1201	Open-ended consequence cascades are treated as unbounded-reference signal.	cascades,consequence,open-ended,signal,treated,unbounded-reference
S-1202	Closure-operator failure is central event in problem emergence.	central,closure-operator,emergence,event,failure,problem
S-1203	Oscillation emerges when interlocutors alternate abstraction and tautology critiques.	abstraction,alternate,critiques,emerges,interlocutors,oscillation,tautology,when
S-1204	Abstractness critique dominates at concrete-example focus.	abstractness,concrete-example,critique,dominates,focus
S-1205	Tautology critique dominates at formal-foundation focus.	critique,dominates,focus,formal-foundation,tautology
S-1206	Alternation without absorption indicates unresolved structural decomposition.	absorption,alternation,decomposition,indicates,structural,unresolved,without
S-1207	The consciousness case demonstrates oscillation at civilization scale.	case,civilization,consciousness,demonstrates,oscillation,scale
S-1208	Scientific rigor and phenomenal focus are reciprocal critiques in that debate pattern.	critiques,debate,focus,pattern,phenomenal,reciprocal,rigor,scientific
S-1209	Neither side absorbs the other when targets are conflated.	absorbs,conflated,neither,other,side,targets,when
S-1210	Word splitting is required before empirical closure attempts.	attempts,before,closure,empirical,required,splitting,word
S-1211	Experience target may remain structurally ungroundable under third-person frame.	experience,frame,may,remain,structurally,target,third-person,under,ungroundable
S-1212	Access target is explicitly closable with operational criteria.	access,closable,criteria,explicitly,operational,target
S-1213	Self-model target is closable with architecture and tests.	architecture,closable,self-model,target,tests
S-1214	Wakefulness target is closable with clinical metrics.	clinical,closable,metrics,target,wakefulness
S-1215	Debate progress requires declaring which sense is in scope.	debate,declaring,progress,requires,scope,sense,which
S-1216	Oscillation is proposed as diagnostic infrastructure.	diagnostic,infrastructure,oscillation,proposed
S-1217	Diagnostic output is where to cut, bind, or quarantine reference.	bind,cut,diagnostic,output,quarantine,reference,where
S-1218	The chapter frames oscillation as sound of non-closing frame.	chapter,frame,frames,non-closing,oscillation,sound
S-1219	The method seeks to stop oscillation by reframing scope.	method,oscillation,reframing,scope,seeks,stop
S-1220	A closure operator should be stated in concrete form.	closure,concrete,form,operator,should,stated
S-1221	The framework favors explicit boundaries over implicit equivocation.	boundaries,equivocation,explicit,favors,framework,implicit,over
S-1222	Structural limits are legitimate outcomes when unbounded targets remain.	legitimate,limits,outcomes,remain,structural,targets,unbounded,when
S-1223	Precision is measured by testability and falsifiability after reframing.	after,falsifiability,measured,precision,reframing,testability
S-1224	The chapter claims this avoids wasted effort on unsplittable formulations.	avoids,chapter,claims,effort,formulations,unsplittable,wasted
